<?xml version="1.0" encoding="UTF-8" standalone="no"?>
<!DOCTYPE clients SYSTEM "clients.dtd">
<clients coulmn0="ID:int" coulmn1="Name:varchar" coulmn2="Age:int" sizeCol="3" sizeRow="2">
<row id="0">
<ID>1</ID>
<Name>ahmed</Name>
<Age>12</Age>
</row>
<row id="1">
<ID>1</ID>
<Name>ahmed mohamed</Name>
<Age>1234</Age>
</row>
</clients>
